{
  "schemaVersion": "1.0.0",
  "approvalId": "ee3ea946-6c87-48a5-ae87-947d3edc0a4d",
  "proposalId": "d01f4e4c-e8a7-44cd-9f7a-3ad5b04963d1",
  "workspaceId": "default-workspace",
  "baseRevision": 0,
  "changeSetDigest": "sha256:cccccccccccccccccccccccccccccccccccccccccccccccccccccccccccccccc",
  "approvedAt": "2026-07-29T00:00:02.000Z",
  "approvedBy": "local-user"
}
